6/25/2021,An unrestrained westbound motorist leaving a signalized business drive struck a northbound unrestrained motorist on Greenfield Road approximately 350’ north of Northland Drive.   The unrestrained westbound motorist was killed.  ,PendingWIP,Greenfield Rd,Northland Dr,,,,1,1,Troy,Oak Park,,,,,,,,,,,,,1,,,
7/19/2021,A southbound motorist struck another motorist who was stopped for a red light at the northern leg of the intersection of Airport Road and Hatchery Road.  The driver of the southbound vehicle was killed.  ,Reviewing,Airport Rd,Hatchery Rd,,,,1,1,Waterford,,,,,,,,,,,,,,,,,
7/21/2021,A motorcyclist was struck on Oakwood Road approximately 200’ west of Tonda Dr when the motorcyclist crossed over the centerline of a curve and was struck by an oncoming motorist.  The motorcyclist was killed.  ,Completed,Oakwood Rd,Tonda Dr,,,,1,1,Brandon,,,,,,,,,1,,,,,,,1,
8/20/2021,"A motorist was travelling westbound on Cooley Lake Road at Hiller Road.  While attempting to make a left turn onto Hiller Road, the westbound motorist struck an eastbound motorist on Cooley Lake Rd.  The eastbound motorist was killed.  ",New,Cooley Lake Rd,Hiller Rd,,,,1,1,Waterford,,,,,,,,,,,,,,1,,,
8/26/2021,A southbound motorcyclist lost control of his motorcycle on Sashabaw Road north of Island Park Drive crossing over the centerline and striking the guardrail.  The motorcyclist then slid across the oncoming lane of traffic coming to a rest in the southbound lane of Sashabaw Road.  The motorcyclist was killed.  ,Reviewing,Sashabaw Rd,Island Park Dr,,,,1,1,Waterford,,,,,,1,,,,,,,,,,1,
8/27/2021,"A motorist traveling southbound on Lockhaven Road, at Willow Road may have suffered from an unknown medical emergency and proceeded to initiate an eastbound left turn into an oncoming vehicle on Willow Road.  It is unknown if the southbound motorist was restrained in the vehicle.  The southbound motorist was pronounced dead after being admitted to a local hospital.  ",Reviewing,Lockhaven Rd,Willow Rd,,,,1,1,West Bloomfield,,,,,,,,,,,1,,,,,,1
9/23/2021,Two pedestrians were crossing Pontiac Lake Road west of Village Green Lane when one pedestrian was struck by an eastbound motorist.  The pedestrians were not crossing in marked crosswalk.  The crash occurred at night. The location was noted to have limited lighting and it was raining.  The struck pedestrian was killed.  ,PendingWIP,Pontiac Lake Rd,Village Green,,,,1,1,Waterford,,,,,,,,,,,,,1,,1,,
10/18/2021,An eastbound motorist on Tienken Road struck a southbound pedestrian 40 feet east of Clear Creek Drive.  The pedestrian was in or near the marked crosswalk.  The pedestrian was killed.  ,Reviewing,Teienken Rd,Clear Creek Dr,,,,1,1,Avon,Rochester Hills,,,,,,,,,,,,,1,1,,
10/20/2021,A motorist traveling east on East Holly Road struck a motorist traveling south on Tindall Road.  The southbound motorist was unrestrained as the vehicle was not equipped.  The southbound motorist was killed. ,Reviewing,Holly Rd,Tindall Rd,,,,1,1,Springfield,,,,,,,,,,,,,,,,,1
11/9/2021,A southbound motorist on Napier Road approximately 780 feet south of Twelve Mile Road when left of center for unknown reasons and struck a tree.  The motorist was killed.,PendingWIP,Napier Rd,12 Mile Rd,,,,1,1,Novi,,,,,1,,,,1,,,,,,,,
11/17/2021,A southbound motorist on Livernois Road struck two pedestrians crossing at westbound Big Beaver Road.  The pedestrians were in a marked crosswalk.  The pedestrians were crossing Livernois Road when southbound Livernois Road had a green indication.  One pedestrian was killed.  ,Reviewing,Livernois Rd,Big Beaver Rd,,,,1,1,Troy,,,,,,,,,,,,,,,1,,
11/18/2021,A westbound motorist on Pontiac Trail was struck by an eastbound motorist on Silver Lake Road.  The westbound motorist was killed.  ,New,Pontiac Trail,Silver Lake Rd,,,,1,1,Lyon,,,,,,,,,,,,,,,,,1
11/21/2021,A southbound motorist on Livernois Road making a left turn onto Drexelgate Parkway struck a southbound pedestrian crossing Drexelgate Parkway.  The pedestrian was in a marked crosswalk.  The pedestrian was killed.  ,Reviewing,Livernois Rd,Drexelgate Parkway,,,,1,1,Avon,Rochester Hills,,,,,,,,,,,,1,,1,,1
11/24/2021,A pedestrian laying in the eastbound lane of South Boulevard just east of Old Chatham Drive was struck by an eastbound motorist.  The pedestrian was killed.  ,New,South Blvd,Old Chatham Dr,,,,1,1,Bloomfield,,,,,,,,,,,,,,,1,,
12/16/2021,A westbound motorist in the center left turn lane was turning left from Twelve Mile Road onto Murray Crescent Road was struck from behind by a second westbound motorist for an unknown reason.  The second motorist was later pronounced dead at the hospital.  ,PendingWIP,12 Mile Rd,Murray Crescent Rd,,,,1,1,Southfield,,,,,,,,,1,,,,,,,,1
12/22/2021,A westbound motorist on Twelve Mile Road just west of Halstead Road struck a pedestrian in the northern most lane of Twelve Mile Road.  The pedestrian was not located in a marked crosswalk.  Alcohol was listed as a contributing factor for the pedestrian that was struck and killed.  ,PendingWIP,12 Mile Rd,Halstead Rd,,,,1,1,Farmington Hills,,,,,,,,,,1,,,,,1,,
1/1/2022,"A motorist was southbound on Southfield Road north of Webster Road when they struck another southbound motorist, struck a curb and rolled their vehicle several times.  The motorist had to be extricated from the vehicle.  The motorist was killed.  Alcohol was listed as a contributing factor.  ",,Southfield Rd,Webster Rd,,,,1,1,,,,,,,1,,,,1,,,,,,,
1/16/2022,A motorist was southbound on Kensington Road north of E. Long Lake Road when they proceeded to go left of center though a red traffic signal indication and struck a motorist westbound on E. Long Lake Road.  Both vehicles left the roadway striking a utility pole.  The southbound motorist was traveling at a high rate of speed while eluding a police unit.  The southbound motorist was later pronounced dead at a local hospital.  ,New,Kensington Rd,Long Lake Rd,,,,1,1,Bloomfield,,,,,,1,,,1,,,,,,,,
2/7/2022,"A motorist was southbound on Lake George Road approximately 800’ north of Drahner Road when they encountered icy conditions, left the roadway and struck a tree.  The motorist was killed.  ",New,Lake George Rd,Drahner Rd,,,,1,1,Addison,,,,,1,1,,,,,,,1,,,,
3/3/2022,A front end loader with bucket was exiting the Auburn Hills DPW yard onto eastbound Brown Road approximately 500’ west of Giddings Road when the bucket went left of center striking a westbound motorist.  The westbound motorist was killed.  ,New,Brown Rd,Gidding Rd,,,,1,1,Avon,,,,,,,,,1,,,,,,,,
3/4/2022,A pedestrian was walking in the westbound lane of Indianwood Road east of Oneida Trail when they were stuck and killed by a westbound motorist.  The pedestrian was not in a marked pedestrian crossing.  ,New,Indianwood Rd,Oneida Trail,,,,1,1,Orion,,,,,,1,,,,,,,,,1,,1
4/12/2022,An unhelmeted motorcyclist and unhelmeted passenger were traveling northeast on Williams Lake Road when they ran a red light and struck a motorist westbound on Pontiac Lake Road.  Both the motorcyclist and passenger were transported to a local hospital were the motorcyclist died from injuries sustained in the crash.,New,Williams Lake Rd,Pontiac Lake Road,,,,1,1,Waterford,,,,1,,1,,,,,,,,1,,1,
4/18/2022,"A motorist was driving southbound on Branford Drive approximately 500’ NE of Berwick Drive at a high rate of speed.  The motorist lost control, crossed the centerline struck a rock and trees.  An unrestrained rear seat passenger was killed.  ",New,Branford Dr,Berwick Dr,,,,1,1,West Bloomfield,,,,,1,1,,,1,,,,1,1,,,
4/23/2022,A motorist was traveling eastbound on Maple Road approaching Halstead Road crossed over the centerline and struck a signpost and utility pole.  A front passenger was required to be extricated from the vehicle (by first responders) and later died at a local hospital.  Alcohol use by the driver was suspected.  ,,Maple Rd,Halstead Rd,,,,1,1,West Bloomfield,,,,,1,,,,1,1,,,,,,,1
5/9/2022,A motorcyclist was traveling southbound on Baldwin Road approximately 1050’ north of Clarkston Road when they lost control of the motorcycle in a curve.  The motorcyclist was thrown from the motorcycle and was killed.  ,New,Baldwin Rd,Clarkston Rd,,,,1,1,Orion,,,,,1,1,,,,,,,,,,1,1
5/15/2022,A motorcyclist was westbound on Pontiac Trail and was struck by an eastbound motorist turning left onto northbound Beck Road.  The motorcyclist was killed.  ,,Pontiac Trail,Beck Rd,,,,1,1,Wixom,,,,1,,,,,,,,,,,,1,
5/15/2022,A motorist was traveling southwest on Lake Angelus Road approximately 150” northeast of Heatherstone Drive at a speed too fast for roadway conditions and lost control of the vehicle.  The vehicle struck a tree.  The motorist was killed,New,Lake Angelus,Heaterhstone,,,,1,1,Waterford,,,,,1,1,,,1,,,,,1,,,
6/21/2022,"An unhelmeted motorcyclist was northbound on Dixie Highway approximately 1,320 feet north of Gail Drive when they lost control of the motorcycle existed to the left of the roadway.  The motorcyclist was killed.  ",,Dixie Hwy,Gail Drive,,,,1,1,????,,,,,1,,,,1,,,,,,,1,
6/24/2022,An unhelmeted motorcyclist was traveling southbound on Dixie Highway and was struck by a northbound motorist turning left onto Hutchinson Road.  The motorcyclist was killed.  ,,Dixie Hwy,Hutchinson Road,,,,1,1,Springfield,,,,,,,,,,,,,,,,1,1
7/10/2022,An unhelmeted motorcyclist was traveling southbound on Clarkston Road just north of Newport Drive when the left the roadway to the right when entering a curve.  The motorcyclist was killed.  ,,Clarkston Rd,Newport Drive,,,,1,1,Independence,,,,,,1,,,,,,,,,,1,
8/30/2022,A motorist was northbound on Adams Road was turning left onto westbound Auburn Road.  The northbound motorist turned in front of a southbound motorist.  The northbound motorist was killed.  ,,Adams Rd,Auburn Rd,,,,1,1,Avon,Rochester Hills,,,1,,,,,,,,,,,,,1
9/7/2022,A pedestrian was walking eastbound on Kier Road 1000 feet west of Ellis Road was struck by a westbound motorist.  The pedestrian was killed.  ,,Keir Rd,Ellis,,,,1,1,Springfield,,,,,,1,,,,,,1,,1,1,,
9/20/2022,A motorist was northbound on Adams Road north of Baypoint Street when they departed the roadway to the right.  The vehicle overturned and came to rest on the driver’s side.  The motorist was killed.  Alcohol and drugs were listed as contributing factors.  ,,Adams Rd,Baypoint Street,,,,1,1,Avon,Rochester Hills,,,,1,,,,,1,,,,1,,,
9/20/2022,A motorist was westbound on Avon Road turning left onto southbound Adams Road when they were struck by a northbound Adams Road motorist.  The northbound motorist disregarded the traffic signal.  The westbound motorist was killed.  ,,Avon Rd,Adams Rd,,,,1,1,Avon,Rochester Hills,,,1,,,,,,,,,,,,,1
10/3/2022,A motorist was westbound on Wattles Road turning northbound onto Kensington Road when they lost control and left the roadway into roadside trees.  The motorist was killed.    ,,Wattles Rd,Kensington Rd,,,,1,1,Bloomfield,,,,1,1,,,,,,,,,,,,
10/15/2022,A pedestrian was walking westbound on 12 Mile Road 70 feet west of Balmoral Way was struck by a eastbound motorist.  The pedestrian was killed.  ,,12 Mile Rd,Balmoral Drive,,,,1,1,Farmington Hills,,,,,,,,,,,,,,,1,,1
10/22/2022,"A motorcyclist was southbound on Harvey Lake Road 800 feet south of Wardlow Road when they struck a deer, lost control and struck a northbound vehicle.  The motorcyclist was killed.    ",,Harvey Lake Rd,Wardlow Rd,,,,1,1,Highland,Highland,,,,,,,1,1,,,,,1,,1,
10/31/2022,A bicyclist was riding northbound on Opdyke Road at Hempstead Road was struck by a northbound motorist.  The bicyclist was killed.  ,,Opdyke Road,Hemstead Rd,,,,1,1,Avon,City of Auburn Hills,1,,,,,,,,,,,,1,1,,
11/14/2022,A motorist was westbound on Pontiac Trail 50 feet east of Willow Lane when they ran off the road and struck a tree. The motorist was killed. The motorist was not wear a seatbelt. Alcohol and drugs were listed as contributing factors.   ,,Pontiac Trail,Willow Lane,,,,1,1,Lyon,,,,,1,,,,,1,,,,,,,
11/16/2022,A motorist was northbound on Novi Road 200 feet north of Genmar when they lost control in icy conditions and went left of center. They were struck by a southbound vehicle. The motorist was killed. ,,Novi Rd,Genmar,,,,1,1,Novi,City of Novi,,,,,,,,1,,,,1,,,,1
11/21/2022,A bicyclist was northbound crossing 12 Mile Road 15 feet west of Stephenson Highway.  They disregarded the traffic control. They were struck by a westbound motorist.  The bicyclist was killed. Alcohol was listed as contributing factor for the motorist. ,,12 Mile Rd,Stephenson Hwy,,,,1,1,Madison Heights,Royal Oak,,,1,,,,,,1,,,,,1,,
11/29/2022,"A motorist was eastbound on Grange Hall Road 1,320 feet east of Perryville Road when they ran off the road and struck a tree. The motorist was killed. ",,Grange Hall Rd,Perryville Rd,,,https://goo.gl/maps/dpXAX8m9m6qdBToa6,1,1,Groveland,Groveland,,,,1,1,,,1,,,,,,,,
1/1/2023,A pedestrian in the southbound lane of Rochester Road 50 feet south of Whims Road  was stuck and killed by a southbound motorist.  Alcohol was listed as contributing factor for the pedestrian.,New,Rochester Rd,,,,,1,1,Oakland,,,,,,,,,,1,,,,1,1,,
1/19/2023,A motorist was northbound on Duck Lake Road was turning left onto westbound Cooley Lake Road.  The northbound motorist turned in front of a eastbound motorist.  The northbound motorist was killed.  ,,Duck Lake Rd,Cooley Lake,,,,1,1,Highland,Highland,,,1,,,,,,,,,,1,,,
1/26/2023,A motorist was traveling northbound on Adams Road south of Silverbell Road crossed over the centerline and struck a southbound vehicle. The northbound motorist was killed. Drugs and alcohol use by the driver was suspected.,,Adams Rd,Dutton Rd,,,,1,1,Oakland,Oaklaand,,,,,,,,1,1,,,1,,,,
1/29/2023,A motorist was traveling southbound on Bogie Lake Road south of Cedar Island Road crossed over the centerline and struck a northbound vehicle. The southbound motorist was killed. Alcohol use by the driver was suspected.  ,,Bogie Lake Rd,Cedar Island Rd,,,,1,1,,,,,,,1,,,1,1,,,,,,,
1/31/2023,"A motorist traveling eastbound on Hatchery Road east of Williams Lake Road may have suffered from an unknown medical emergency crossed left of center and struck a mailbox. The motorist was pronounced dead after being admitted to a local hospital. * Reclassified as PDO, as the fatality was attributed to the medical emergency not the crash.  ",,,,,,,1,0,,,,,,1,,,,1,,1,,,,,,
2/10/2023,"A motorist was driving eastbound on Stony Creek Road approaching Lake George Road at a high rate of speed. The motorist failed to stop at the stop sign, crossed Lake George, left the roadway, and struck a tree.  The motorist was killed.  ",,,,,,,1,1,,,,,1,1,1,,,,,,,,,,,1
2/27/2023,"A motorist traveling westbound on Pontiac Lake Road approximately 500’ west of Oak Pointe Drive may have suffered from an unknown medical emergency drove off the roadway to the right and struck a tree. The motorist was pronounced dead after being admitted to a local hospital.      * Reclassified as PDO, as the fatality was attributed to the medical emergency not the crash.",,Pontiac Lake Rd,Hospital Rd,,,,1,0,Waterford,Waterford,,,,1,,,,,,1,,,,,,1
3/16/2023,A motorist was traveling southbound on Bogie Lake Road between the north and south intersections of Young Road crossed over the centerline side-swiped two northbound vehicle and struck a third head-on. The third northbound motorist was killed. Drug use by the southbound driver was suspected.   ,,,,,,,1,1,,,,,,,,,,1,1,,,,,,,
3/22/2023,"A motorist was driving eastbound on Maple Road approaching Decker Road and failed to stop at the red signal. The eastbound motorist struck a southbound vehicle, which struck a northbound vehicle, which struck a stationary westbound vehicle. The passenger in the right rear seat of the northbound vehicle was killed.",,,,,,,1,1,,,,,1,,1,,,,,,,,1,,,
3/25/2023,A motorist was driving westbound on Predmore Road approaching Rochester Road and failed to stop at the stop sign. The motorist struck a northbound vehicle. The motorist was killed.  ,,,,,,,1,1,,,,,1,,,,,,,,,,,,,
4/4/2023,A motorist was traveling southbound on Middlebelt Road between the north of 12 Mile Road crossed over the centerline stuck three northbound vehicles head-on. The first northbound motorist was ejected from the vehicle and killed. ,,,,,,,1,1,,,,,,,1,,,1,,,,,1,,,
5/29/2023,A southbound motorist was on North Holly Road attempting to turning left onto eastbound Belford Road.  The southbound motorist turned in front of a northbound motorcycle.  The northbound motorist was killed.  ,,,,,,,1,1,,,,,1,,,,,,,,,,,,1,1
6/3/2023,A go cart was driving southbound exiting a private drive onto Hatchery Road and failed to yield to westbound traffic. The go cart was struck by a westbound vehicle. The go cart driver was killed.,,,,,,,1,1,,,,,,,,,,,,,,,,,,
7/5/2023,A pedestrian was attempting to cross from the south to the north side of Maple Road 200 feet east of Lahser Road. The pedestrian was stuck and killed by an eastbound motorist.  ,,,,,,,1,1,,,,,,,,,,,,,,,,1,,
7/7/2023,"A motorist was traveling southbound on Dixie Highway north of Grange Hall Road. They ran off the road to right, over-corrected, crossed over the centerline and struck a northbound vehicle. The southbound motorist was unrestrained, they were ejected from the vehicle and killed. ",,,,,,,1,1,,,,,,,1,,,1,,,,,,,,
7/7/2023,A northbound motorist was attempting to turn left from Livernois Road onto Maple Road. They proceeded though a red signal to complete the turn. They were stuck by a west bound vehicle. The northbound motorist was killed.  ,,,,,,,1,1,,,,,1,,,,,,,,,,,,,
9/6/2023,A motorist was traveling northbound on Southfield Road south of 12 Mile Road. They crossed over the center lane and struck a southbound vehicle. The northbound motorist was killed. ,,,,,,,1,1,,,,,,,,,,1,,,,,,,,
10/1/2023,"A motorist was traveling westbound on Davisburg Road west of Eagle Road at a high rate of speed. They ran off the roadway to the left, struck a tree, and were killed. An eastbound motorist struck debris from the crash that was thrown into the roadway.",,Davisburg Rd,Eagle Rd,,,,1,1,Rose,Rose,,,,1,1,,,,,,,,1,,,
11/25/2023,A motorist was traveling westbound on 14 Mile Road east of John R Road. They crossed over the center lane and struck an eastbound vehicle. The eastbound motorist was killed.,,14 Mile Rd,John R,,,,1,1,,,,,,,,,,1,,,,,,,,1
12/5/2023,A pedestrian was attempting to cross from the west to the east side of Fransworth Road 500 feet south of Union Lake Road. The pedestrian was struck and killed by a northbound motorist.  The pedestrian was not in a marked crosswalk.  ,,Fransworth Rd,Union Lake Rd,,,,1,1,,,,,1,,,,,,,,,,,1,,1
2/12/2024,"A motorist was traveling eastbound on Oak Hill Road west of Dartmouth Road. They went straight across the T intersection, struck a tree, and were killed. The driver was not wearing a seatbelt.",,Oak Hill Rd,Dartmouth Rd,,,,1,1,Independence,Independence,,,1,1,1,,,,,,,,,,,
3/13/2024,"A motorist was traveling eastbound on Cooley Lake Road 150’ east of Long Lane. They ran off the roadway to the left, struck a concrete pillar, rolled over, and were killed. The driver was not wearing a seatbelt. Alcohol was suspected to be involved",,Cooley Lake Rd,Long Ln,,,,1,1,White Lake,White Lake,,,,1,1,,,1,1,,,,1,,,
4/14/2024,A motorist was traveling northbound on Ormond Road 200’ south of Oakguard Drive. They lost control of their motorcycle and were thrown to the ground. They struck their head and were killed. The driver was not wearing a helmet. ,,Ormond Rd,Oakguard Dr,,,,1,1,White Lake,White Lake,,,,,,,,,,,,,,,,
5/8/2024,A motorist was traveling westbound and ran over a ped in the road.,,South Blvd,Sheffield Rd,,,,1,1,Avon,Auburn Hills,,,,,,,,,,,,,,1,,
5/16/2024,A motorist was traveling eastbound on Commerce Rd turning left into Marcello Dr.  They failed to yield the right of way to a motorcycle.,,Sleeth Rd,Marcello Dr,,,,1,1,Commerce,Commerce,,,1,,,,,,,,,,,,1,
6/14/2024,A motorist was travelling northbound on Baldwin Road. They attempted to turn left onto westbound Hummer Lake Road. They struck and killed a southbound motorcyclist. The motorcyclist was not wearing a helmet.,,Baldwin Rd,Hummer Lake Rd,,,,1,1,Brandon,Brandon,,,1,,,,,,,,,,,,1,1
6/16/2024,A motorcyclist was stopped on northbound Wixom Road attempting to turn left on to westbound Stratford Villa Way.  They were struck by northbound vehicle. The driver of the motorcycle was killed. They were not wearing a helmet.,,Wixom Rd,Statford Villa Way,,,,1,1,Commerce,Commerce,,,1,,,,,,,,,,,,1,
7/6/2024,A motorist was travelling eastbound on Long Lake Road. They disregarded the red traffic signal at Rochester Road. They struck a northbound vehicle. A passenger in the eastbound vehicle was killed.,,Rochester Rd,Long Lake Rd,,,,1,1,Troy,Troy,,,1,,,,,,,,,,,,,
7/6/2024,"A motorcyclist was travelling southbound on Sashabaw Road just south of Fowler Drive. They crossed left of center, struck a northbound vehicle, and fell off the motorcycle. They were then struck and killed by another northbound vehicle.",,Sashabaw Rd,Fowler Dr,,,,1,1,Independence,Independence,,,,,,,,1,,,,,,,1,
7/9/2024,A motorist was travelling westbound on Normandale Street. They were attempting to turn onto Lahser Road. They field to yield to a northbound bus. A passenger in the westbound vehicle was killed.,,Lahser Rd,Normandale St,,,,1,1,Southfield,Southfield,,,1,,,,,,,,,,,,,
7/19/2024,A motorist was travelling eastbound on Walton Boulevard 400 feet west of Sashabaw Road. They struck a bicyclist crossing from the north to the south side of the road. The bicyclist was killed. The bicyclist was not wearing a helmet.   ,,Walton Blvd,Sashabaw Rd,,,,1,1,Waterford,Waterford,,,1,,,,,,,,,,1,1,,
7/19/2024,"A motorist was travelling westbound on White Lake Road 400 feet west of Ormond Road. They crossed left of center, went off the road, and struck a road sign, a fence, and group of trees. The driver was killed.",,White Lake Road,Ormaond Rd,,,,1,1,White Lake,White Lake,,,,1,,,,1,,1,,,,,,1
8/1/2024,A volunteer fire fighter was travelling northbound on Crooks Road with emergency lights and siren on. The proceed through the red traffic signal at Maple Road. They struck a westbound vehicle. A passenger in the westbound vehicle was killed.,,Crooks Rd,Maple Rd,,,,1,1,Troy,Troy,,,1,,,,,,,,,,,,,
8/27/2024,A motorcyclist was traveling southbound on John R Road. They struck stopped southbound vehicle waiting at the signal to turn left onto Niagara Drive. The driver of the motorcycle was killed.,,John R Rd,Niagara Drive,,,,1,1,Troy,Troy,,,1,,,,,,,,,,,,1,1
9/1/2024,A motorist was travelling southbound at the first turn around on Long Lake Road west of Livernois Road. They were attempting to cross eastbound Long Lake Road and enter the parking lot to the south. They field to yield to and were stuck by an eastbound vehicle. The southbound driver was killed.,,Long Lake Rd,Livernois Rd,,,,1,1,Troy,Troy,,,1,,,,,,,,,,,,,1
9/7/2024,A pedestrian was attempting to cross from the northside to the southside of Maple Road 30’ west of Langford Street. They were struck and killed by an eastbound vehicle. ,,Maple Rd,Langford Rd,,,,1,1,Troy,Troy,,,1,,,,,,,,,,1,1,,
9/19/2024,A motorcyclist was attempting to turn left from southbound Opdyke Road to eastbound Pontiac Road. The signal turned red and they tried to complete the turn and clear the intersection. They were struck by a northbound vehicle that ran the red signal. The driver of the motorcycle was killed. ,,Opdyke Road,Pontiac Rd,,,,1,1,Avon,Auburn Hills,,,1,,,,,,,,,,,,1,1
9/22/2024,"A motorist was traveling southbound on Dequindre Road south of Big Beaver Road at a high rate of speed. They went airborne twice, lost control, skidded sideways and struck a curb. The vehicle rolled over multiple times ejecting and killing the driver. The driver was unrestrained.",,Dequindre Rd,Big Beaver Rd,,,,1,1,Troy,Troy,,,,1,1,,,,,,,,1,,,
9/28/2024,"A motorcyclist was travelling eastbound on Cooley Lake Road just east of Immensee Street. They lost control, crossed left of center, fell off the motorcycle, and were killed. The driver had a blood alcohol level of 0.12.",,Cooley Lake Rd,Immensee St,,,,1,1,Commerce,Commerce,,,,1,1,,,1,1,,,,1,,1,
10/3/2024,A motorist was attempting to leave the scene of a previous crash on Wixom Road just south of Saws Way. Travelling southbound they stuck a driver that had exited their vehicle to inspect the damage from the previous crash. They were dragged by the southbound vehicle for 30 to 40 feet and killed.,,Wixom Rd,Saw Way,,,,1,1,Wixom,Wixom,,,,,1,,,,,,,,,,,1
10/15/2024,"A motorist was travelling southbound on Southfield Road 100 feet north of Northwestern Highway. They lost control, went off the road, and struck a tree. The driver stated they were uninjured, but they were admitted to the hospital for a medical condition. The driver was pronounced dead at the hospital.",,Southfield Rd,Northwestern Hwy,,,,1,1,Southfield,Southfield,,,,1,1,,,,,1,,,,,,1
10/18/2024,An ATV was travelling northbound on Jones Road south of Hatchery Road at a high rate of speed. The driver lost control and struck a tree. The two passengers were ejected from the vehicle. The driver and one of the passengers were killed. None of them were wearing helmets.,,Jones,Hatchery Rd,,"42.672855588552544, -83.40368894487789",,1,2,Waterford,Waterford,,,,1,1,,,,,,,,,,1,
10/29/2024,A motorist was traveling eastbound on Pontiac Trail 300 feet west of Hollingsworth Drive. They ran off the roadway to the right and struck a tree. The two passengers were killed. The driver and passengers were unrestrained. Alcohol was suspected to be involved.,,Pontiac Trail,Hollingsworth Dr,,"42.54916237794155, -83.46417927238855",,1,2,Commerce,Walled Lake,,,,1,1,,,,1,,,,,,,
