Date,Description,Status,Major Rd,Minor Rd,Inconclusive,Cords,Map,Fatal Crash,Fatal Persons,Twp,CVT,Distracted,Driveway Related,Intersection Related,Road side Fixed object,"Human (speeding, Seatbelt, Helmet, Drwosy, imparied, distracted)",Work Zone?,Animal Related?,Left of Center,Alcohol_Drugs,Medical,Gravel,Wet/Snow/Ice,Teen,Pedestrian_Bike,Motorcycle/ATV/Snowmobile,Elderly
1/1/2001,,,,,,,,32,35,,,,,,,,,,,,,,,,,,
1/1/2002,,,,,,,,37,38,,,,,,,,,,,,,,,,,,
1/1/2003,,,,,,,,28,29,,,,,,,,,,,,,,,,,,
1/1/2004,,,,,,,,32,34,,,,,,,,,,,,,,,,,,
1/1/2005,,,,,,,,39,41,,,,,,,,,,,,,,,,,,
1/1/2006,,,,,,,,29,33,,,,,,,,,,,,,,,,,,
1/1/2007,,,,,,,,25,25,,,,,,,,,,,,,,,,,,
1/1/2008,,,,,,,,19,20,,,,,,,,,,,,,,,,,,
2/8/2009,"Pontiac Trail west of West Road, pedestrian hit by two vehicles.",,Pontiac Trail,West Rd,,,,1,1,,,,,,,,,,,,,,,,1,0,
2/27/2009,"Williams Lake Road, near Pirrin Drive, west of Airport Road, two vehicles head on collision.",,Williams Lake Rd,Airport Rd,,,,1,1,,,,,,,,,,,,,,,,0,0,
3/29/2009,"Davisburg Road and Ormond Road intersection (two fatalities), two vehicle crash (angle).",,Davisburg Rd,Ormaond Rd,,,,1,2,,,,,,,,,,,,,,,,0,0,
6/3/2009,"Pontiac Lake Road at Scott Lake Road, west of intersection, single vehicle lost control, run off the road and hit utility pole and a fence.",,Pontiac Lake Rd,Scott Lake,,,,1,1,,,,,,1,,,,,,,,,,0,0,
6/5/2009,"Grass Lake Road, south of Woodland Road, ATV run off the road, hit tree and ejected, hit a second tree.",,Grass Lake,Woodland Rd,,,,1,1,,,,,,1,,,,,,,,,,0,0,
6/8/2009,"Oakwood Road at Legault Boulevard, vehicle stopped on Road for left turning vehicle, rear ended by a truck.",,Oakwood Rd,Legault Blvd,,,,1,1,,,,,,,,,,,,,,,,0,0,
6/19/2009,"Milford Road, south of Davisburg Road, motorcyclist lost control at railroad crossing.",,Milford Rd,Davisburg Rd,,,,1,1,,,,,,,,,,,,,,,,0,1,
6/22/2009,"Bald Eagle Lake Road, near Bird Road, single vehicle lost control, run off the road and struck a tree.",,Bald Eagle Lake Rd,Bird Rd,,,,1,1,,,,,,1,,,,,,,,,,0,0,
7/10/2009,"Baldwin Road and Davison Lake Road intersection, two vehicles, angle crash, fail to yield right of way at a stop sign.",,Baldwin Rd,Davison Lake Rd,,,,1,1,,,,,,,,,,,,,,,,0,0,
8/2/2009,"Sashabaw Road and Flemings Lake Road intersection, two vehicles, angle crash.",,Sashabaw Rd,Flemings Lake Rd,,,,1,1,,,,,,,,,,,,,,,,0,0,
10/7/2009,"East Leonard Road, near Secord Lake Road, single vehicle crash, collided with a tree lying in the road.",,East Leonard Rd,Secord Lake Rd,,,,1,1,,,,,,1,,,,,,,,,,0,0,
10/29/2009,"Pontiac Trail WB at Century Drive, two vehicles, semi-truck stopped to turn left hit in rear by another vehicle driven by intoxicated motorist.",,Pontiac Trail,Century Dr,,,,1,1,,,,,,,,,,,1,,,,,0,0,
11/30/2009,"Crooks Road NB and Long Lake Road WB, two vehicles, angle crash.",,Crooks Rd,Long Lake Rd,,,,1,1,,,,,,,,,,,,,,,,0,0,
12/1/2009,"Jossman Road SB, north of Perryville Road, single vehicle run-off the road and hit a tree.",,Jossman Rd,Perryville Rd,,,,1,1,,,,,,1,,,,,,,,,,0,0,
12/2/2009,"Long Lake Road EB, two vehicles, head-on left turn.",,Long Lake Rd,,,,,1,1,,,,,,,,,,,,,,,,0,0,
12/16/2009,"Hickory Ridge Trail NB, south of General Motors Road, single vehicle run-off the road and hit two trees.",,Hickory Ridge Rd,General Motors,,,,1,1,,,,,,1,,,,,,,,,,0,0,
12/17/2009,"Southfield Road SB, single vehicle run-off the road and hit a tree.",,Southfield Rd,,,,,1,1,,,,,,1,,,,,,,,,,0,0,
12/20/2009,Pedestrian crossing Orchard Lake Road at Powers Road was hit by a northbound vehicle. The pedestrian died in the hospital on 01/15/10.,,Orchard Lake Rd,Powers Rd,,,,1,1,,,,,,,,,,,,,,,,1,0,
1/11/2010,"Joslyn Road NB, south of Clarkston Road, near DNR Lake Sixteen access site. NB vehicle loss control (snow & icy conditions) and crossed centerline, struck by SB vehicle, angle accident. Three fatalities in NB vehicle.",,Joslyn Rd,Clarkston Rd,,,,1,3,,,,,,,,,,,,,,1,,0,0,
2/21/2010,"Lasher Road at Eleven Mile Road, NB motorist travelling at high rate of speed runs red light and hits WB motorist making left turn. Third vehicle also involved. Motorist in first and second vehicle killed.",,Lahser,11 Mile Rd,,,,1,2,,,,,,,1,,,,,,,,,0,0,
3/12/2010,A NB Dequindre Road motorist was killed when making a left turn at Maple Road on the permissive phase and was hit by a SB motorist. Four vehicles were involved.,,Dequindre Rd,Maple Rd,,,,1,1,,,,,,,,,,,,,,,,0,0,
3/17/2010,"Motorist WB on Commerce Road, west of Harold Avenue was killed when he lost control and hit a tree fleeing the seen of another accident.",,Commerce Rd,Harold Ave,,,,1,1,,,,,,1,,,,,,,,,,0,0,
4/1/2010,"Grand River Avenue near Napier Road, EB car crossed centerline and hit by WB truck. Passenger in the car was killed.",,Grand River Ave,Napier Rd,,,,1,1,,,,,,,,,,,,,,,,0,0,
4/13/2010,"Wixom Road near West Road, NB truck crossed centerline and hit by SB Wixom Road vehicle. Driver of vehicle heading southbound was killed.",,Wixom Rd,West Rd,,,,1,1,,,,,,,,,,,,,,,,0,0,
4/21/2010,A motorist EB on Maple Road at Wixom Road entered the intersection on the red indication and hit a NB motorist. The driver of the NB Wixom Road Vehicle died in the hospital 11 days after the accident.,,Maple Rd,Wixom Rd,,,,1,1,,,,,,,,,,,,,,,,0,0,
4/26/2010,"Livernois Road north of Big Beaver Road, SB motorcyclist killed when he hit a car that pulled out in front of him from the northern most driveway of the Liberty Center.",,Livernois Rd,Big Beaver Rd,,,,1,1,,,,,,,,,,,,,,,,0,1,
6/23/2010,Dequindre Road and Fourteen Mile Road. Bicyclist hit by two different vehicles.,,Dequindre Rd,14 Mile Rd,,,,1,1,,,,,,,,,,,,,,,,1,0,
6/30/2010,EB Long Lake Road near Kensington Road. Motorist struck tree and was killed.,,Long Lake Rd,Kensington Rd,,,,1,1,,,,,,1,,,,,,,,,,0,0,
6/30/2010,"Sheldon Road at Snell Road, NB unlicensed underage motorist disregarded stop sign and hit a WB motorist, killing the driver.",,Sheldon Rd,Snell,,,,1,1,,,,,,,,,,,,,,,,0,0,
7/25/2010,"Motorist on SB Middlebelt Road changed lanes at a high rate of speed into the northbound lane, struck and killed a bicyclist near Linden Street.",,Middlebelt Rd,Linden St,,,,1,1,,,,,,,1,,,,,,,,,1,0,
8/6/2010,"Motorist on EB Pontiac Trail, east of Bradford (e/o Martindale Road), turned left into driveway in front of EB motorcyclist. Driver of Motorcycle was killed and passenger died 3 days later.",,Pontiac Trail,Martindale,,,,1,2,,,,,,,,,,,,,,,,0,1,
8/13/2010,"Motorist WB Stoney Creek Road, west of Rochester Road was killed when she lost control and hit a tree.",,Stoney Creek Rd,Rochester Rd,,,,1,1,,,,,,1,,,,,,,,,,0,0,
8/27/2010,Motorist travelling westbound on Twelve Road at Stansbury Boulevard crossed the centerline and hit eastbound vehicle head on. Passenger in westbound vehicle was killed.,,12 Mile Rd,Stansbury Blvd,,,,1,1,,,,,,,,,,,,,,,,0,0,
10/3/2010,Motorist travelling northbound Milford Road died the next day after they turned left at Mill River Boulevard and hit a southbound Milford Road vehicle.,,Milford Rd,Mill River Bld,,,,1,1,,,,,,,,,,,,,,,,0,0,
10/17/2010,Motorist travelling southeasterly on Andersonville Road near Northwest Court hit and killed a pedestrian walking along the road.,,Andersonville Rd,Northwest Ct,,,,1,1,,,,,,,,,,,,,,,,1,0,
11/8/2010,"NB Orchard Lake Road, north of Northwestern Highway a motorist hit and killed a pedestrian that was walking in the middle of the road.",,Orchard Lake Rd,Northwestern Hwy,,,,1,1,,,,,,,,,,,,,,,,1,0,
11/9/2010,WB Motorist on Grange Hall Road west of North Saginaw Road/North Holly Road hit and killed a pedestrian crossing the Road west of the intersection.,,Grange Hall Rd,North Saginaw Rd,,,,1,1,,,,,,,,,,,,,,,,1,0,
12/6/2010,NB Hickory Ridge near Dunham Road motorist was killed when they ran off the road and hit a tree.,,Hickory Ridge Rd,Dunham Rd,,,,1,1,,,,,,1,,,,,,,,,,0,0,
12/7/2010,Pedestrian was killed at the intersection of Haggerty Road and Ten Mile Road when they were hit by a vehicle. They were crossing Ten Mile Road on the east leg.,,Haggerty Rd,10 Mile Rd,,,,1,1,,,,,,,,,,,,,,,,1,0,
1/16/2011,"Motorist travelling SB Dequindre Road, south of Square Lake/19 Mile Road started passing another SB vehicle, hit this vehicle first and then hit a NB vehicle head-on killing the driver of the NB vehicle. Alcohol was a factor in the crash.",,Dequindre Rd,Square Lake Rd,,,,1,1,,,,,,,,,,,1,,,,,0,0,
1/19/2011,Motorist travelling SB Dequindre Road just north of Long Lake Road lost a load from the bed of his pickup truck. He turned around and returned to retrieve his belongings. After exiting his vehicle he was hit by a SB motorist and was killed.  The SB motorist did not stop at the scene of the accident.,,Dequindre Rd,Long Lake Rd,,,,1,1,,,,,,,,,,,,,,,,0,0,
1/23/2011,Motorist travelling SB on Duck Lake Road south of Engleman Road was killed when he lost control of his vehicle and hit a tree. Alcohol and/or drugs may have been a factor in the crash.,,Duck Lake Rd,Engleman Rd,,,,1,1,,,,,,1,,,,,1,,,,,0,0,
1/25/2011,"Motorist travelling NB Milford Road, south of I-96 was killed when he drifted left of the centerline and hit a SB vehicle head-on. Police said he may have suffered a medical problem that resulted in the accident.",,Milford Rd,I-96,,,,1,1,,,,,,,,,,,,,,,,0,0,
2/10/2011,"Motorist travelling SB Williams Lake Road, just south of Kenwick hit two pedestrians walking in the road. One pedestrian was killed.",,Williams Lake Rd,Kenwick,,,,1,1,,,,,,,,,,,,,,,,1,0,
3/1/2011,"Motorist travelling SB Baldwin Road, south of High View Drive (south of Drahner road) ran off the road into the ditch, struck a large rock and then a utility pole. The driver died 5 days later in the hospital.",,Baldwin Rd,Drahner Rd,,,,1,1,,,,,,1,,,,,,,,,,0,0,
3/6/2011,"A motorist travelling WB Eight Mile Road, west of Beck Road near Westview Drive crossed the centerline and crashed into an EB vehicle killing the driver.",,8 Mile Rd,Beck Rd,,,,1,1,,,,,,,,,,,,,,,,0,0,
3/14/2011,"Motorist travelling WB Williams Lake Road, just east of Manila Court (east of Sashabaw Road) hit and killed a pedestrian walking in the center of the road.",,Williams Lake Rd,Sashabaw Rd,,,,1,1,,,,,,,,,,,,,,,,1,0,
3/17/2011,Pedestrian walking on Cass Elizabeth Road near Iroquois Street was hit by a motorist and killed.,,Cass Elizabeth Rd,Iroquois St,,,,1,1,,,,,,,,,,,,,,,,1,0,
3/20/2011,One motorist was killed when three vehicles were involved in a crash at the intersection of 12 Mile Road and Greenfield Road.,,12 Mile Rd,Greenfield,,,,1,1,,,,,,,,,,,,,,,,0,0,
3/22/2011,"A motorist travelling NB Lahser Road, near Midway Avenue was killed when they crossed the centerline and crashed into an SB vehicle.",,Lahser,Midway,,,,1,1,,,,,,,,,,,,,,,,0,0,
4/4/2011,Motorist on eastbound Silverbell Road was killed when he went past construct zone signs and crashed through Road Closed Barricades hitting two parked pieces of the contractor’s heavy equipment vehicles.,,Silverbell Rd,,,,,1,1,,,,,,1,,1,,,,,,,,0,0,
5/23/2011,"Motorist on southbound Middlebelt Road, 2,500 feet north of Eleven Mile Road crossed the centerline and sideswiped a northbound vehicle and then hit a second northbound vehicle head-on.  A passenger in the southbound vehicle was killed.",,Middlebelt Rd,11 Mile Rd,,,,1,1,,,,,,,,,,,,,,,,0,0,
5/25/2011,Motorist was killed when they pulled out from gas station driveway south of University Drive in front of a Tandem Trailer Truck traveling NB on Opdyke Road,,Opdyke Road,University Dr,,,,1,1,,,,,,,,,,,,,,,,0,0,
5/27/2011,"SB Motorist on John R Road, north of Losee Drive turned left into the Best Buy parking lot driveway and was hit by a northbound vehicle. Driver of the SB vehicle was taken to the hospital and released the next day. She was found dead at her home later that same day.",,John R Rd,Losee Dr,,,,1,1,,,,,,,,,,,,,,,,0,0,
6/28/2011,"Motorcyclist eastbound on Lone Pine Road at Lasher Road when starting out from the green light, popped the clutch and lost control turning right onto southbound Lasher Road, striking the curb and falling from the motorcycle onto the shoulder.",,Lone Pine Rd,Lahser Rd,,,,1,1,,,,,,,,,,,,,,,,0,1,
7/1/2011,"A motorist exiting a private drive approach just east of Franklin Road failed to yield the right of way when they pulled out in front of a motorcyclist travelling eastbound on 12 Mile Road, approaching Northwestern Highway. The motorcyclist was killed.",,Franklin Rd,,,,,1,1,,,,,,,,,,,,,,,,0,1,
7/14/2011,A motorist northbound on Greenfield Road at Oxford Avenue/San Quenton Avenue had right rear door open transporting a large metal cabinet. The door struck a sign on the southeast corner and veered across all lanes to the northwest corner and ran into a utility pole.,,Greenfield Rd,Oxford Ave,,,,1,1,,,,,,1,,,,,,,,,,0,0,
7/27/2011,"A northbound Giddings Road motorist, south of Liberty Drive struck and killed a bicyclist also travelling northbound.",,Giddings Rd,Liberty Dr,,,,1,1,,,,,,,,,,,,,,,,1,0,
8/7/2011,"Motorcyclist westbound on Elizabeth Lake Road at Glandon Street (East of Union Lake Road) ran off the road, clip some mailboxes and lost control.",,Elizabeth Lake Rd,Union Lake Rd,,,,1,1,,,,,,,,,,,,,,,,0,1,
8/8/2011,"A motorist eastbound on Pontiac Trail, 500 feet east of Old Orchard Trail ran off the road into a ditch and struck a tree.",,Pontiac Trail,Old Orchard Trail,,,,1,1,,,,,,1,,,,,,,,,,0,0,
8/16/2011,A motorist on westbound Clarkston Road was killed when they turned left onto Sashabaw Road in front of an eastbound motorist.,,Clarkston Rd,Sashabaw Rd,,,,1,1,,,,,,,,,,,,,,,,0,0,
8/22/2011,"A motorist was killed when travelling southbound on Silver Lake Road south of Walton Boulevard. They first crossed the centerline and sideswiped a northbound vehicle, then spun around and were hit by a third vehicle also travelling southbound.",,Silver Lake Rd,Walton Blvd,,,,1,1,,,,,,,,,,,,,,,,0,0,
8/27/2011,Motorcyclist with passenger was eastbound on Pontiac Lake Road at Erwindale Road (West of M-59) and crossed the centerline in a curve and hit an eastbound vehicle. The passenger was thrown from the motorcycle and killed.,,Pontiac Lake Rd,Erwindale Rd,,,,1,1,,,,,,,,,,,,,,,,0,1,
8/27/2011,Driver of a moped on westbound South Boulevard just east of Sheffield Road fell off his moped and later died from his injuries.,,South Blvd,Sheffield Rd,,,,1,1,Avon,Auburn Hills,,,,,,,,,,,,,,0,1,
9/5/2011,NB motorist on Milford Road between Rose Center Road and Davisburg Road crossed the centerline and hit a southbound motorist. Drivers of both vehicles were killed.,,Milford Rd,Rose Center Rd,,,,1,2,,,,,,,,,,,,,,,,0,0,
9/9/2011,EB motorist on Baybrook Drive east of Pine Orchard Drive was killed when they ran off the road left into a ditch and hit a tree.,,Baybrook Dr,Pine Orcahrd Dr,,,,1,1,,,,,,1,,,,,,,,,,0,0,
9/20/2011,SB motorist on Silver Lake Road at Dixie Highway was stopped for a red light proceeded to make a right turn on red and hit a pedestrian. The pedestrian died later at the hospital.,,Silver Lake Rd,Dixie Hwy,,,,1,1,,,,,,,,,,,,,,,,1,0,
9/27/2011,NB motorist on Novi Road was killed when they ran the red light at 12 Mile Road and was hit by an eastbound truck pulling a trailer with a backhoe on it.,,Novi Rd,12 Mile Rd,,,,1,1,,,,,,,,,,,,,,,,0,0,
10/19/2011,NB Motorist on Cooley Lake Road near Brookhaven Court crossed the centerline and hit a westbound/southbound vehicle head-on. The driver of the second vehicle was killed.,,Cooley Lake Rd,Brookhaven Ct,,,,1,1,,,,,,,,,,,,,,,,0,0,
11/21/2011,EB Motorist on Pontiac Trail just west of South Hill Road crossed the centerline and ran off the road continued eastbound in the ditch before striking a tree and rolling over. The driver was ejected from the vehicle. Alcohol believed to be a factor.,,Pontiac Trail,South Hill Rd,,,,1,1,,,,,,,,,,,1,,,,,0,0,
12/7/2011,"EB motorist on Middle Road, east of Hickory Ridge Road ran off the road, struck several trees and overturned the vehicle while falling down an embankment. A passenger was ejected from the vehicle and died.",,Middle Rd,Hickory Ridge,,,,1,1,,,,,,,,,,,,,,,,0,0,
12/7/2011,WB Walton Blvd motorists crossed the centerline striking a guardrail and then sideswiped vehicle #2 before hitting vehicle #3 head-on that was EB on Walton Blvd. Elderly driver of vehicle #1 was transported to the hospital where he was pronounced deceased. He may have suffered a medical condition prior to the crash.,,Walton Blvd,,,,,1,1,,,,,,,,,,,,,,,,0,0,1
12/13/2011,"Pedestrian walking in the eastbound lane of West Maple Road approximately 1,000 feet east of Benstein Road was hit by a vehicle. Driver of the vehicle did not stop. Pedestrian died from injuries the following day.",,West Maple Rd,Benstein Rd,,,,1,1,,,,,,,,,,,,,,,,1,0,
12/31/2011,Pedestrian crossing Southfield Road at George Washington Drive (south of 10 Mile Road) from west to east was killed when struck by two southbound vehicles.,,Southfield Rd,George Washington Dr,,,,1,1,,,,,,,,,,,,,,,,1,0,
1/19/2012,Motorist with passenger in the vehicle on northbound Baldwin Road approximately 300 feet north of Judah Road lost control during snow and blowing snow conditions and crossed the centerline where they were hit by a southbound vehicle. The passenger was killed.,,Baldwin Rd,Judah Rd,,,,1,1,,,,,,,,,,,,,,1,,0,0,
1/21/2012,"Motorist was killed when travelling westbound on Pontiac Lake Road, near Margie Drive, west of Fisk Road when a tree fell on their vehicle. The vehicle came to rest in a swampy ravine. The drive died the next day from injuries sustained in the accident.",,Pontiac Lake Rd,Margie Dr,,,,1,1,,,,,,1,,,,,,,,,,0,0,
2/4/2012,"Pedestrian in the middle of southbound Carroll Lake Road, just south of West Grand Traverse at night was killed when struck by a southbound vehicle.",,Carroll Lake Rd,West Grand Traverse Rd,,,,1,1,,,,,,,,,,,,,,,,1,0,
2/12/2012,"A motorist has died the following day after a crash on northbound Rochester Road, north of Gunn Road where she hit a snowy patch and slid across the centerline into the path of a southbound motorist.",,Rochester Rd,Gunn Rd,,,,1,1,,,,,,,,,,,,,,1,,0,0,
2/13/2012,"Motorist with passenger travelling on eastbound Cooley Lake Road near McDougal Street crossed the centerline and ran off the road into the ditch, rolled over and hit a fence, both were ejected from the vehicle, neither were wearing a seatbelt. The driver was killed. Alcohol is believed to be a factor in the crash.",,Cooley Lake Rd,McDougal St,,,,1,1,,,,,,,,,,,1,,,,,0,0,
3/1/2012,"Motorist was killed when they crossed the centerline on northbound Harvey Lake Road, just south of Dunleavy Drive, and hit a southbound vehicle head-on.",,Harvey Lake Rd,Dunleavy Dr,,,,1,1,,,,,,,,,,,,,,,,0,0,
3/3/2012,"Motorist was killed when they crossed the centerline on northbound Haggerty Road near the intersection of Oakley Park Road, and hit a southbound vehicle head-on. The southbound vehicle was hit from behind by a third vehicle involved in the crash.",,Haggerty Rd,Oakley Park Rd,,,,1,1,,,,,,,,,,,,,,,,0,0,
4/3/2012,"Motorist was killed when they crossed the centerline on westbound Pontiac Trail, approximately 1500 feet west of West Park Drive, and hit an eastbound vehicle head-on.",,Pontiac Trail,West Park Dr,,,,1,1,,,,,,,,,,,,,,,,0,0,
4/30/2012,Motorist was killed when they crossed the centerline on northbound Sashabaw Road just north of Meigs Avenue and hit a southbound vehicle head-on.,,Sashabaw Rd,Meigs Ave,,,,1,1,,,,,,,,,,,,,,,,0,0,
5/2/2012,"Motorist was killed when they crossed the centerline on northbound White Lake Road approximately 500 feet north of Andersonville Road, sideswiping a southbound vehicle before crashing head-on into a second southbound vehicle.",,White Lake Road,Andersonville Rd,,,,1,1,,,,,,,,,,,,,,,,0,0,
6/19/2012,"Motorist travelling westbound on East Holly Road, west of Webber Road, lost control ran off the road and overturned several times. The driver was killed and the passenger was an A injury.",,East Holly Rd,Webber Rd,,,,1,1,,,,,,,,,,,,,,,,0,0,
6/27/2012,A motorist northbound on Farmington Road turned left onto Kingsfield Drive and was hit by a southbound vehicle. The passenger in the turning vehicle died seven days later in the hospital from the injuries.,,Farmington Rd,Kingsfield Dr,,,,1,1,,,,,,,,,,,,,,,,0,0,
7/24/2012,A motorcyclist on northbound Sashabaw Road was killed when they ran into the back of another vehicle stopped to make a left turn onto Bella Rose Boulevard.,,Sashabaw Rd,Bella Rose Blvd,,,,1,1,,,,,,,,,,,,,,,,0,1,
7/24/2012,"A motorist southbound on North Holly Road, south of Mitchell Road, lost control of their vehicle and ran off the road rolling the vehicle over. The driver was not wearing a seat belt and was ejected from the vehicle. Alcohol was a factor in the crash.",,North Holly Rd,Mitchell Rd,,,,1,1,,,,,,,,,,,1,,,,,0,0,
7/28/2012,"A motorcyclist northbound on Newton Road at Listeria Street/Rio Vista Street was killed when he lost control, crossed the centerline and slid into a southbound vehicle.",,Newton Rd,Listeria St,,,,1,1,,,,,,,,,,,,,,,,0,1,
8/21/2012,"RCOC truck driver on Pearson Road, just east of Milford Road was killed when the RCOC truck overturned on the shoulder.",,Pearson Rd,Milford Rd,,,,1,1,,,,,,,,,,,,,,,,0,0,
10/31/2012,"Two motorists were killed when a westbound Eight Mile Road vehicle, east of Napier Road at the sports Park Driveway crossed the centerline and hit an eastbound vehicle head-on. Drivers of both vehicles died.",,8 Mile Rd,Napier Rd,,,,1,2,,,,,,,,,,,,,,,,0,0,
11/3/2012,A westbound Long Lake Road motorist turning left into Saddle Brook Court failed to yield to an eastbound motorist and their vehicle was struck on the passenger side. A passenger in the westbound vehicle was killed.,,Long Lake Rd,Saddle Brook Ct,,,,1,1,,,,,,,,,,,,,,,,0,0,
11/4/2012,"A motorist was killed when travelling on westbound Pontiac Trail, west of Grace Rae Court, crossed the centerline and ran off the road hit two utility poles, a sign post and two trees before coming to a stop. Alcohol and excessive speed is believed to be a factor in the crash.",,Pontiac Trail,Grace Rae Ct,,,,1,1,,,,,,,1,,,,1,,,,,0,0,
11/17/2012,"Two vehicle collision on Milford Road, just north of Forest Ridge Drive/Heritage Drive resulted in one fatality and an A-injury. Dense fog in the area and alcohol may have been factors in the crash.",,Milford Rd,Forest Ridge Dr,,,,1,1,,,,,,,,,,,1,,,,,0,0,
12/24/2012,A motorist travelling north on Coats Road was killed when she lost control south of Oakwood Road and ran off the road and hit a tree. Alcohol appears to be a factor in the crash.,,Coats Rd,Oakwood Rd,,,,1,1,,,,,,1,,,,,1,,,,,0,0,
12/31/2012,A motorist travelling westbound on Grange Hall Road west of Judy Ann Road was killed when he sideswiped another vehicle and ran of the road into several trees. Alcohol and excessive speed may have been factors in the crash.,,Grange Hall Rd,Judy Ann Rd,,,,1,1,,,,,,,1,,,,1,,,,,0,0,
1/21/2013,A motorist travelling northbound on Opdyke Road at M-59 crossed the centerline and hit a southbound vehicle head-on. The motorist in the southbound vehicle was killed. Alcohol is believed to have been a factor in the crash.,,Opdyke Road,M-59,,,,1,1,,,,,,,,,,,1,,,,,0,0,
3/1/2013,"A motorist travelling northbound on Adams Road, north of Butler Road crossed the centerline and sideswiped a southbound vehicle, then hit a second southbound vehicle head-on. The driver that crossed the centerline was killed in the crash. A pre-existing medical condition may have been a factor in the crash.",,Adams Rd,Butler Rd,,,,1,1,,,,,,,,,,,,,,,,0,0,
3/21/2013,A motorist travelling southeasterly on Andersonville Road was killed when they lost control on the snow covered road coming out of the curve approximately a half-mile northeasterly of Northwest Court. Their vehicle sideswiped a northwesterly travelling vehicle and then was hit by another northwesterly travelling vehicle after they slide sideways in front of it.,,Andersonville Rd,Northwest Ct,,,,1,1,,,,,,,,,,,,,,1,,0,0,
7/6/2013,Motorcyclist on Milford Road was killed when they collided with a van near Munger Road.,,Milford Rd,Munger Rd,,,,1,1,,,,,,,,,,,,,,,,0,1,
7/7/2013,"A motorist was killed when they ran off the road at a high rate of speed on westbound Holcomb Road, east of Brook Lane, and hit a tree.",,Holcomb Rd,,,,,1,1,,,,,,1,1,,,,,,,,,0,0,
7/21/2013,"A motorcyclist travelling at a high rate of speed eastbound on Clarkston Road at Lakeview Drive lost control, crossed the centerline, and hit the side of a westbound vehicle. The motorcyclist died from their injuries.",,Clarkston Rd,Lakeview Dr,,,,1,1,,,,,,,1,,,,,,,,,0,1,
8/10/2013,A motorist travelling southbound on Lahser Road ran a red light at Eleven Mile Road and hit a westbound vehicle. A passenger in the westbound vehicle was killed.,,Lahser,11 Mile Rd,,,,1,1,,,,,,,,,,,,,,,,0,0,
8/24/2013,A motorcyclist travelling eastbound on Elizabeth Lake Road was killed when a westbound motorist turned left onto Exmoor Road in front of the motorcycle.,,Elizabeth Lake Rd,Exmoor Rd,,,,1,1,,,,,,,,,,,,,,,,0,1,
9/20/2013,"A motorist travelling northbound on Hall Road turning left onto Andersonville Road was killed when his vehicle slid sideways, hit a guardrail, went airborne over the guardrail and was ejected. The driver was not wearing a seatbelt.",,Hall Rd,Andersonville Rd,,,,1,1,,,,,,1,,,,,,,,,,0,0,
9/20/2013,"A motorist travelling eastbound on Andersonville Road, 200 feet east of White Lake Road crossed the centerline and hit a westbound vehicle head-on. The motorist that crossed the centerline was killed.",,Andersonville Rd,White Lake Rd,,,,1,1,,,,,,,,,,,,,,,,0,0,
